mysql> source test.sql
ERROR 1064 (42000): You have an error in your SQL syntax; check the manual that corresponds to your MySQL server version for the right syntax to use near 'select count(*) from Artist' at line 2
mysql> source test.sql
+----------+
| count(*) |
+----------+
|     3503 |
+----------+
1 row in set (0.00 sec)

+----------+
| count(*) |
+----------+
|      275 |
+----------+
1 row in set (0.00 sec)

mysql> source test.sql
+----------+
| count(*) |
+----------+
|     3503 |
+----------+
1 row in set (0.01 sec)

+----------+
| count(*) |
+----------+
|      275 |
+----------+
1 row in set (0.00 sec)

mysql> SELECT * FROM Album LIMIT 5;
+---------+---------------------------------------+----------+
| AlbumId | Title                                 | ArtistId |
+---------+---------------------------------------+----------+
|       1 | For Those About To Rock We Salute You |        1 |
|       2 | Balls to the Wall                     |        2 |
|       3 | Restless and Wild                     |        2 |
|       4 | Let There Be Rock                     |        1 |
|       5 | Big Ones                              |        3 |
+---------+---------------------------------------+----------+
5 rows in set (0.00 sec)

mysql> SELECT * FROM Artist LIMIT 5;
+----------+-------------------+
| ArtistId | Name              |
+----------+-------------------+
|        1 | AC/DC             |
|        2 | Accept            |
|        3 | Aerosmith         |
|        4 | Alanis Morissette |
|        5 | Alice In Chains   |
+----------+-------------------+
5 rows in set (0.00 sec)

mysql> SELECT Title,Name FROM Album
    -> JOIN Artist ON Album.ArtistId = Artist.ArtistId
    -> LIMIT 5;
+---------------------------------------+-----------+
| Title                                 | Name      |
+---------------------------------------+-----------+
| For Those About To Rock We Salute You | AC/DC     |
| Balls to the Wall                     | Accept    |
| Restless and Wild                     | Accept    |
| Let There Be Rock                     | AC/DC     |
| Big Ones                              | Aerosmith |
+---------------------------------------+-----------+
5 rows in set (0.00 sec)

mysql> DESC Genre;
+---------+--------------+------+-----+---------+----------------+
| Field   | Type         | Null | Key | Default | Extra          |
+---------+--------------+------+-----+---------+----------------+
| GenreId | int          | NO   | PRI | NULL    | auto_increment |
| Name    | varchar(120) | YES  |     | NULL    |                |
+---------+--------------+------+-----+---------+----------------+
2 rows in set (0.00 sec)

mysql> * INSERT INTO Genre (Name) VALUES (‘Trad’);
ERROR 1064 (42000): You have an error in your SQL syntax; check the manual that corresponds to your MySQL server version for the right syntax to use near '* INSERT INTO Genre (Name) VALUES (‘Trad’)' at line 1
mysql> INSERT INTO Genre (Name) VALUES (‘Trad’);
ERROR 1054 (42S22): Unknown column '‘Trad’' in 'field list'
mysql> INSERT INTO Genre (Name) VALUES ("Trad");
Query OK, 1 row affected (0.03 sec)

mysql> DESC Genre
    -> ;
+---------+--------------+------+-----+---------+----------------+
| Field   | Type         | Null | Key | Default | Extra          |
+---------+--------------+------+-----+---------+----------------+
| GenreId | int          | NO   | PRI | NULL    | auto_increment |
| Name    | varchar(120) | YES  |     | NULL    |                |
+---------+--------------+------+-----+---------+----------------+
2 rows in set (0.00 sec)

mysql> * SELECT LAST_INSERT_ID();
ERROR 1064 (42000): You have an error in your SQL syntax; check the manual that corresponds to your MySQL server version for the right syntax to use near '* SELECT LAST_INSERT_ID()' at line 1
mysql> SELECT LAST_INSERT_ID();
+------------------+
| LAST_INSERT_ID() |
+------------------+
|               26 |
+------------------+
1 row in set (0.00 sec)

mysql> SELECT Name FROM Genre WHERE GenreId = 26;
+------+
| Name |
+------+
| Trad |
+------+
1 row in set (0.00 sec)

mysql> * UPDATE Genre SET Name = “Traditional” WHERE Name = “Trad”;
ERROR 1064 (42000): You have an error in your SQL syntax; check the manual that corresponds to your MySQL server version for the right syntax to use near '* UPDATE Genre SET Name = “Traditional” WHERE Name = “Trad”' at line 1
mysql> UPDATE Genre SET Name = “Traditional” WHERE Name = “Trad”;
ERROR 1054 (42S22): Unknown column '“Trad”' in 'where clause'
mysql> UPDATE Genre SET Name = "Traditional" WHERE Name = "Trad"
    -> ;
Query OK, 1 row affected (0.07 sec)
Rows matched: 1  Changed: 1  Warnings: 0

mysql> SELECT Name FROM Genre WHERE GenreId = 26
    -> ;
+-------------+
| Name        |
+-------------+
| Traditional |
+-------------+
1 row in set (0.00 sec)

mysql> DELETE FROM Genre WHERE Name = “Traditional”; 
ERROR 1054 (42S22): Unknown column '“Traditional”' in 'where clause'
mysql> DELETE FROM Genre WHERE Name = 'Traditional';
Query OK, 1 row affected (0.03 sec)

mysql> SELECT Name FROM Genre WHERE GenreId=26;
Empty set (0.00 sec)

